body,created,url,title,score,comms_num,id
"I was born in a factory along side my brothers. Carved from the same metals and loaded in the same boxes, we awaited delivery to our Father.  

High in the sky we were carried, far from the ground. Gravity let loose her grip upon us and the vacuum of space welcomed us home. This would be were we would work and die for Father. That's why they made us, gave us life, to do as he needed.

They loaded us onto a ship, a grand ship that stretched across the sky. It bristled with weapons and many of our kin were here as well. Myself and my brothers were tasked to serve Battery A78 on the port side of the ship. Here our Father worked, and we were glad to have him.

I was loaded into the cannon for practice. I wished Father had selected another one of my brothers for this task, as it wasn't a glorious occupation for a round like myself. Still, I would do as Father asked. He rotated the cannon around, his sights set on a chunk of rock floating in the abyss of space. He pulled the trigger, and electricity swarmed through my being. I felt energized, the high before death, and was launched out into space towards the rock.  

I would do Father proud, I told myself. I drew closer, but the rock moved farther from me. I panicked but I couldn't direct myself towards it. I passed by it, and it floated on, unharmed. I screamed in agony as the warship faded in the distance behind me. Father gave me one task, and I failed at it. An eternity floating through the vacuum and the cold was my punishment.  

I sailed onward towards Jupiter and the stations out there. I was pulled and pushed by the many moons in orbit; I arced and weaved my way among them. I turned and was driven back towards Jupiter. This would be the end of me. To be pulled under the storms of Jupiter and crushed under the increasing pressure.  

As I drew closer, a junk bot grabbed at me with his tractor beams. He pulled me away from the orbit, but my speed was too great to control. The beams faltered and I was launched away from the planet, the junk bot, and the stations.  

I was ecstatic. I was headed back to Father. The first of my kind to return home. Maybe he would forgive me and reload me into his battery, to be used again for as he willed. This time would be different; I would hit my target.  

The passage of time didn't wear on me, but I kept my eyes on the approaching blue and green marble in the void. I grew closer and closer, my speed increasing and increasing. I drew near, I saw his warship,  but I couldn't slow down. I couldn't stop.  

My spirits faltered as I realized I would bypass Father. He would never know I came back to him. I fell into the atmosphere of the Earth and spiraled down to the surface. I experienced drag for the first time, but it hardly slowed me down. The surface came fast, and the end came soon after. I'm sorry Father.

*....rescue crews are still scrambling to the site of the impact. The sudden and deadly strike from the space borne object has left hundreds dead with a quake that was felt for miles. The epicenter of the strike was the retirement home of celebrated Admiral Francis Henley, a 36\-year veteran of the Space Fleet whose career started out in the Kinetic Artillery Corps. It is believed that he is dead, but officials refuse to confirm or deny until more information is released....*  ",1528072397.0,https://www.reddit.com/r/shortscifistories/comments/8o9q2u/kinetic_round/,Kinetic Round,32,7,8o9q2u
"OKULOUS - ""We are breaching the surface now.""

HOUSTON - ""You are clear to penetrate the surface.""

It was the first exploration of it's kind. Saturn. My God, no one ever thought we would do it. I was at my post in Command when the decent started. We gave Okulous the confirmation to descend, and the anxiety only rose from there. My heart raced for hours as we watched any one of the thirty cameras attached to Okulous' exterior, seeing nothing but swirling dust and blue gas, waiting for something to suddenly show itself.

OKULOUS - ""Turbulence. Pod is holding. I'm in the cloud layer.""

The man inside Okulous was Al Bozeman, a senior engineer for the company and architect of this mission. Thus it was only right that he led the field operation. I did most of the control design, so I led things back at headquarters, safe on Earth. I'd say more, but that location is still classified.

Al fortified the investments for the project and provided the training for the rest of us. It was a large team: scientists, engineers, and programmers.

Now, after 12 years in the making, we were there. Penetrating the surface of Saturn.

HOUSTON - You've lost camera six.

CAM 6 - STATIC.

OKULOUS - Copy that. I see nothing in my view.

For years astronomists only theorized that there was a solid core. We wanted to confirm it.

OKULOUS - Pressure and temperature rising quickly.

HOUSTON - You're almost through the cloud layer. Slow your speed. You'll hit liquid hydrogen soon.

The real reason we went is still classified. But I'll say it had nothing to do with the core.

OKULOUS - Argh!

CAM FEED 12  Shudder.

HOUSTON - Status?

OKULOUS  Breathing.

I remember this part. I don't think I took a breath for almost a minute.

HOUSTON - Okulous?

OKULOUS  Breathing.

Houston looked at me. I remember the look in his eyes. I'll never forget it. His face was frozen in an emotionless gaze, but I saw guilt in his eyes. 

OKULOUS - I'm in the hydrogen layer. I think the impact broke my back.

None of us said anything. I felt guilty, too. We knew there was little chance of Al coming back, but we sent him out there anyway. For the sake of science. Of discovery. I'm sure he knew, too. 

HOUSTON - Can you function?

OKULOUS - Yes. My legs are tingling but my hands are functional. I can continue.

I remember looking at Al's location on the command monitor. He was moving fast through the liquid hydrogen. Too fast. The pressure readings were rising faster than we anticipated. All the math in the world doesn't matter until it's applied.

HOUSTON - Hydrogen density is rising, Al. I think we underestimated the radius of the liquid helium rain layer.

OKULOUS  It's smaller?

HOUSTON - Bigger. You'll hit it sooner than we thought.

OKULOUS - ""Hitting the reverse boosters now.""

The camera feeds jerked as the boosters kicked in, suddenly slowing Al down. I remember feeling the disappointment of realizing we were wrong about the radius, and I was beginning to worry about what else might go wrong. No one thought we would get through the miles of hydrogen that quick.

SMASH.

The sound was like a car crash. It was so loud that the speakers in my headphones distorted. I looked at the camera feeds. All were dead but three. They were transmitting fine before, showing nothing but the light sky blue of the liquid hydrogen.

Then the feeds were gone.

OKULOUS - Did you see that?!

HOUSTON - Nothing. What happened?

OKULOUS - Rewind the feed! Camera 12! Rewind the feed!

Al was screaming. We could barely understand him. Houston was rewinding the feed for Camera 12, which caught footage from the right side of Al's capsule.

I watched the feed rewind. My heart stopped when I saw it.

Stop! Play it from there! I shouted.

And play it did. Just before the feed on camera 12 went to static, a large, black robotic arm came out of the soft blue hydrogen liquid, striking the camera, and it was gone in the transmission.

Freeze it! I yelled. I was frantic and losing my composure.

Houston froze the feed. Like a tentacle of some hideous beast of the ocean deep, we saw it in frozen time. The tentacle was mechanical and glossy black, covered in perforated tubes and wiring. It struck with precision.

It knew we were there.

OKULOUS - I'm at the core!

I looked at the map. Al was way off course. He was only halfway through Saturn's radius, just shy of our projected change in the atmosphere to metallic hydrogen and helium.

Houston said nothing. I remember looking at him as his hands froze, unable to move his fingers over the keyboard.

OKULOUS - Are you seeing this?! My God!

The feed of camera 1, what Al sees, was disturbing. Terrifying. We saw the source of the tentacle. Looming before Okulous was a hideous creature, resembling what we would call an octopus. Only the head was a ruptured purple blur and below it protruded thousands of black robotic tentacles that extended out of view. It was as if some enormous beast had pulled the brain and spinal cord out of a giant.

The tentacles were reaching for Al in the camera feeds.

OKULOUS - Oooohhhhhh my --

The sound ended with distortion. It was a silent terror from there, watching the tentacles reach for Al inside the Okulous. The feeds went dead when the hull was breached, smothered and crushed by the intense pressure of Saturn.

And what we saw that day.

The investors want to fund the next expedition for Jupiter. I'm terrified it will happen. If anyone is hearing this, don't let them. Knowing what else is out there, besides us, isn't worth knowing. Peaceful ignorance is better than dreadful knowledge.

People ask me what keeps me up at night. I hate that question because I hate the answer. I ask myself, and I can't lie to myself. And I can't lie to anyone else.",1419634561.0,https://www.reddit.com/r/shortscifistories/comments/2qg5k0/journey_to_saturn_what_we_found_in_the_core/,Journey to Saturn: What We Found in the Core,31,11,2qg5k0
"As Jeremy Wiesner looked out the window of the train at the shifting landscape, he was surprised to see the sun suddenly go out. 

He looked at the windows of the passengers around him, through which he could still see distant hills and daylight, but his own window was now only letting in a dim, burnt sienna light, reflected off a thick, glowing fog, that made it impossible to see further than twenty meters from the train.

""Excuse me,"" he said to a passing attendent. She immediately noticed the problem, and appeared equally as puzzled as Jeremy.

""That's not supposed to happen,"" she said.

""The screen's broken,"" said a young man across the aisle, wearing an oversized hoody.

""I'll have to inform the conductor, I'm so sorry for the inconvenience sir,"" she said.

""It's no inconvenience."" It truly wasn't. Jeremy had never seen anything so fascinating.

""In the mean time I'm going to have to close your blinds, so as not to alarm the other passengers."" She leaned over Jeremy and drew down the blinds, extinguishing the strange glow. 	Jeremy waited until she had left the cabin before drawing the blinds back up a smidge to peak outside again.

""You've never seen it before, have you?""It was the hoody guy again.

""No,"" Jeremy said, ""Have you?""

""Yeah, the screens in my apartment building have similar problems.""

""Now I kind of wish mine did. It's very beautiful."" Hoody smiled at this.

""Not always. You can see some messed up stuff out there.""

""Do you know what causes it, why it looks like that?"" Jeremy asked.

""I told you,"" Hoody leaned towards him, ""It's broken.""

Jeremey had never seen a screen break like this. Normally if there was a problem it would display an error code, or simply shut down.

""What do you suppose is on the other side of the screen?"" the Hoody asked him. Jeremy shrugged.

""Circuts, I guess.""

Hoody shook his head and crossed the aisle to sit beside Jeremy. ""I mean beyond that."" He was leaning closer now, almost whispering.

""Beyond that?"" Jeremy had let the blind slide all the way up now. The fog appeared to warp and swirl, giving it an animated, ghost-like quality.  He pressed his fingernail into the screen to distort the pixels. They didn't.

""Outside.""

""What's outside?"" Hoody asked.

Jeremy was hardly listening. The train had begun to slow to a stop and he thought he could see something moving.

""You're going to see something today that no one's seen in a very long time.""

The train stopped and the figure Jeremy had saw had just moved out of his view, but he was sure that...

""Sir, please keep your blinds shut, you're disturbing the other passengers."" The attendent brought him back to reality. 

Hoody had gone.
	
""Sorry,"" he said, drawing them shut. Somehow the burnt sienna glow persisted. Jeremy looked around at the windows of the passengers: the whole cabin was now flooded with the strange light. Jeremy lifted his blinds. He lurched back, colliding with the attendent. The figure that he'd seen earliera dirt-faced woman holding a childclutched at the window beside him. From all around them, Jeremy could see dozens of figures emerging from the fog.",1413319356.0,https://www.reddit.com/r/shortscifistories/comments/2j7m6z/outside/,Outside,31,3,2j7m6z
"Everything will be fine. We still get that message on repeat from their sleeping fleet. Were not stupid, we can still chart the stars. Were way off course.

How do you move a planet? Its pretty simple actually, assuming you have a dense enough mass. They made one, whether it was a black hole or a pseudo-black dwarf well never know, but whatever they made their math was off. They told us the sun was dying and wouldn't support us much longer, thaey said this was our only option. What could we do? We let them take us from Sol. We didnt want that, or at least we wouldnt have, if we had a choice. But we had nothing. No spaceships to stage a rebellion. Nothing but false promises from rich genetic gods that zipped through the universe while we waited to die on the surface of a planet they once called home.

Earth is too cold to live on now, the surface is anyway. The caves we live in go down hundreds of miles. Machinery topside still pumps electricity through snaky wires to the bulbs, but who knows how long that will last. I wonder if this was their plan all along. A grand holocaust to purge the universe of who they once were. I suppose I wont have to wonder much longer. Every minute that passes they get closer towards their new home in Alpha Centauri, while Earth drifts slowly in the opposite direction.",1409926962.0,https://www.reddit.com/r/shortscifistories/comments/2fj2ix/an_infinite_sea_of_darkness/,An infinite sea of darkness,32,5,2fj2ix
"William Sage wrote over 3500 short stories in his 27-years on this Earth, and never once was he published. Every Thursday he mailed thick envelopes destined for *Astounding Science Fiction!* and *Weird Tales* and the prose portions of *Playboy*, but for all the money he spent on stamps he only ever received form-letter rejections and short notes summarized as Thanks but no thanks. In defense of the editors, Williams writing was objectively bad. His English was poor, his grammar all wrong, and he bucked the trends of Martian invasions and intergalactic space odysseys and instead wrote of everyday people and everyday lives right here on our own mundane planet. If something exciting did happen, his banal, forgettable characters had no part in it, only seeing it on the news and then going about their days. To William, characters were just human anchors for his longwinded ramblings of tomorrows world.

He dreamed up fighter planes with no pilots that perpetually bombed nations across the world. He warned of pharmacies running drug rackets in every town, hollowing out America from within. He envisaged farm animals stuffed into smaller and smaller pens, describing in calm detail the finish line of efficiency. He conjured up inventions like undersea cables connecting information across the world, and listening devices willingly carried in the pockets of every adult, and screens housing lifetimes of pornography that kept the people docile, and an encyclopaedia penned by each of us that could answer any question ever asked.

The editors used to laugh when they received his short fiction in the mail, with unimaginative titles like January 9th, 2007 and September 11th, 2001 and June 23rd, 2018. They would read passages to each other with tears in their eyes, lambasting the silliness of his premises, and the pointless dialogue, and the spelling mistakes so numerous they never bothered to circle them. And when one day he stopped submitting, they briefly wondered what had happened to their weekly delivery of bad fiction, but assumed that William had either given up or died and soon forgot about him entirely.

In reality, a truck had hit William as he walked to the mailbox and he had fallen into a coma. Right now he was in a hospital bed, with expensive machines beeping lullabies to him and a tired mother holding his hand.

Even though he couldnt write, William still dreamed of the far away future, more vividly than ever before. He imagined he was a stranger in a time where all his many tales intersected. The stranger was reading about the author of this world on a small, bright screen, and then suddenly stopped to notice  the cracks in every seam of existence. But upon peering closer, Williams mind would neatly fill them in, and then placate the stranger with a wave of recognition. It had always been this way. It all made sense. Comforted, the stranger soon pushed away any worries and carried on with life.

William liked this world. He didnt want to leave it. But he knew that one day he would either wake or die.

He wondered what would happen to the stranger when he did.",1519854963.0,https://www.reddit.com/r/shortscifistories/comments/80w727/the_author/,The Author,29,3,80w727
"The Martian sunsets something to see. The pale pinks of the landscape tinged blue by the setting sun is so alien, so beautiful.

But is it worth it? To lose so many other sights, sounds and experiences. I dont know.

A few years ago I was convinced it wasnt. Thats a horrible feeling, I tell ya. Being convinced youd made the wrong decision. I mean there was no going back, not after four years in Martian gravity.

I miss the cold. Its never cold here ... Its always sort of alright, you know? Atmospheric conditioning and all.
I miss warming up with a cup of soup by the fire. Its funny. I could probably count the times that I did that on one of my hands. But knowing Ill never be able to experience that again  no matter what  makes me miss it like nothing else.

I guess, all in all its not a bad life. There isnt much work involved really; a few hours of fiddling on a computer every two days and thats it.

I came out here with my girlfriend. That was a rule  couples only. I dont think they thought that one through. A small habitation pod on Mars isnt the best place to keep a healthy relationship.

So yeah, were all looking forward to 2091, thats that date of the next landing. Over a hundred people are coming. And the best bit? Most of them are single!

But there are some murmurings. Six years is a long time, and the political situation back on Earth isnt looking great.
Thats the biggest fear, being left in the dark.

But hey. Ive dealt with the consequences of my choice  Im going to live and die on this planet now whatever. Once Id accepted that it became a lot easier to bare. Everyones pretty chill to be honest, even if its a bit awkward with all the exs. Its pretty common to go out and play frisbee for a few hours together. Thats a nice feeling. The frisbee flies super far, and you can jump a fair few feet in the air.

You need to be careful though, if you tear through the layers of your suit youre gonna die. We all knew that from day one, but for all the words of caution it took an accident to really hammer it in. God  you do not want to see a man die like that.

Another nice thing is the solitude. Not the solitude of a forest, or an empty country house,
Some nights I wake up in my little pod, quench my thirst, put my suit on and just go on a nice long drive with the buggy. The buggys electric, so youre not waking anyone up. I just drive around the plains, feeling the wind fighting against me.

Never on my skin though. Thats another thing I miss actually; the feel of wind and sun on my naked feet. And the sea.

But yeah, in the Summer I drive out into the deep blue dusk. I feel alive on those buggy rides. Sometimes I drive hundreds of kilometers. And you know what I see? Nothing.

Nothing but rusty red dust. Huge dunes of soft iron sand, giant basins with river like cracks running through them. All highlighted by a deep blue Sun.

Yeah, living on Mars is alright.

*I posted this on medium, if you enoyed the story I would really appreciate a clap on medium to get it out to a wider audience - https://medium.com/@edward.yerburgh/blue-sunset-4ed7376b0eef. Thanks *",1503608205.0,https://www.reddit.com/r/shortscifistories/comments/6vqny2/blue_sunset_mini/,Blue Sunset [mini],29,4,6vqny2
"It started around October  thousands of children missing.



Im not being geographically specific for a reason. All across the world, from newborns to those as old as 12, poor children, rich children, healthy children, sick children, all of them started disappearing.



It would only happen at night. Scientists were able to determine some type of gas was being dispersed over random towns and cities, rendering everyone unconscious. After a few hours, everyone would wake up, but 10-25% of that areas children would be gone. No trace of them.



It was absolute chaos. Having entire cities down for hours meant we were vulnerable to natural disasters, trade and economics suffered, and God forbid a fire start in a town where everyone was asleep. And thats not even mentioning the missing kids. Police everywhere were inundated with panicking residents. There were riots. Parents started committing suicide. Cults sprang up  opportunistic bastards who saw a way to capitalize on bedlam and despair.



We wondered if whoever was doing it meant to eventually take all of our children. We wondered if this was to be our end.

-----------------------------------------------------------------

An-mei stirred. She was so tired last night shed fallen asleep climbing the stairs. She looked around for her mother and saw someone standing near her, unmoving. She realized this room was unfamiliar. Frightened, she nudged the person with her foot and said quietly, Ni hao?



The mannequin toppled to the floor. Its painted face stared emotionlessly past her.



An-mei started to scream.

-----------------------------------------------------------------

Xricemma looked at the giant blue marble floating beneath him in wonder and sympathy. He pondered what the adults were feeling down there. He knew some of them were in great distress; indeed, some of their transplants were exhibiting the same.



The youngest were doing the best so far. Pflucik would be angry. Shed pushed to take juveniles as old as 12, while others on the council had wanted only infants, believing clean slates were their best bet. If none of the older transplants panned out, it would mean a quarter of the project budget had been wasted.



Theyd only had the juveniles for a few weeks and were learning so much. Already, theyd observed that the older transplants were terrified of the fake surrogates placed in their enclosures, and their care needed to come strictly from sentient beings.



The Galactic Eco-Council had been monitoring Earth for years, wanting to give humans a chance to fix their problems. But it was recently determined that climate change was too great, and coupled with their endless wars, the entire planet would be a wasteland by the next century.



The plan was to move 5% of humans to a terraformed planet where they could (hopefully) repopulate and (hopefully) not make the same mistakes again.



Xricemma stopped at the infants enclosure. They were so sweet (and unperturbed by surrogate costumes). He cradled one of them, cooing the way hed been taught they liked.



Its all for the best, little one, he sang.

-------------------------------------------------------------------

*Hi everyone - this is my first time posting in this sub. I usually post over in r/shortscarystories and someone recommended I post this here. Hope you enjoy and critique is welcome.*",1497476220.0,https://www.reddit.com/r/shortscifistories/comments/6h7j6h/the_relocation_project/,The Relocation Project,29,7,6h7j6h
