body,created,url,title,score,comms_num,id
"We've finally done it. The one thing all human beings share, the one thing every single human being fears. Death. We've conquered it, we've done the impossible. They're calling it the Fountain of Youth, though it's only a figurative fountain. A small little pill, manufactured and after riots upon riots, given freely to everyone, at birth. It's been a couple years now, but as of this moment...everyone is immortal.

I guess that previous statement isn't exactly true. As I stare out the window, from my hospital bed I've called home for the last few years, I see children playing and their parents cheering them on, full of youthful vigor that could only be possible by the use of the Fountain. It brings a smile to my face. The pain is getting worse now, but I smile as I watch them.

It's then I begin to wonder, what do you do when you know you're the last person who will ever truly die?
",1395907160.0,https://www.reddit.com/r/shortscifistories/comments/21gmx6/the_end_of_death/,The End of Death,33,4,21gmx6
"Lum was a king of his people. But, more importantly, he was a king of his city. Long before the Clerics had restored balance, before the K' had overrun the planet, before humanity was even certain they weren't alone in the universe, he had been Coronated lord and ruler of the city. And even through the leanest centuries, when no mortal thing dared walk the desolate and poisoned streets of his fiefdom, his subjects would uniformly agree that he was a fair and benevolent monarch over the city. His city.

Although many species had thrived in his domain over the centuries, none had the longevity to recall that day. But his most loyal vassals, the buildings and towers, held longer memories. They still told the tale of his Coronation, when weak flesh and bones were replaced with concrete and iron girders. When his failing heart, barely able to keep a steady pace without technical assistance, had been replaced with a 125-gigawatt geothermal power plant, 30 stories beneath the street. And when the final vestiges of his humanity, his brain and nervous system, had been replaced with the vast network of cameras, wires, and antennas weaving across his kingdom, the public address system had played a timpani to announce the start of his reign.

Those were good years, when short-lived things ran plentiful through his highways and air space. His more graceful subjects were full of art, and song, and love, so much so that it burst from their seams and flowed through the alleys of their neighboring nobles. And, oh.... their food! Lum himself had long passed the need to sustain himself with food or drink. But the bristling sensors on every corner fed him the savory (and, frequently, unsavory) scents, sights, and tastes in detail far beyond any mortals capacity to appreciate. 

In return, the king kept the people happy with trade, and employment, and convenience. He kept the traffic lights in perfect sync. He moved the offal from the markets and packing plants out to sea before the merchant neighborhoods complained. He kept the streets clean and well maintained with his army of drones (a sensation that felt similar to brushing his teeth, he recalled). And when dark things happened in the shadows of his outstretched arms, he met out justice. And his subjects, both mortal and stone, loved him for it.

And then, without warning, the K' had come. He had fought alongside his mortal subjects to defend his city. Noble bridges, long the solemn guardians of the city, twisted themselves into death knots and plunged into the waters, taking hundreds of invading troops and their weapons with them. Water towers burst, flooding the streets as sewer grates and manholes opened up, flushing the K' into the undercity and it's waiting denizens. Transformers shorted out hover tanks and ignited alien weapon stores. 

And when the city's original mortal inhabitants had all been killed, and the K' celebrated in victory, Lum sealed off the exit routes and opened the purge valves on the toxic storage vaults, dooming the K' to a slow, painful, wasting death that they could not escape.

Time passed, and without living things, a city of stone and iron citizens takes on a more natural patina. The city was lost to the mortal world. Lum's tenuous, sporadic connection with the few surviving city kings told him that the K' had thrived for a time in the wilds. They dared not go near the cities. And for that, the nobles across every city commended the wise leadership of their kings.

Lum was happy to see the Clerics finally route the K' from the planet. They had a respect for technology and life (both mortal and stone) similar to his older mortal subjects. When they first started connecting to his long unused communication systems (it tickled) and they were cautious not to damage his worn circuitry. As they slowly remapped the city, he learned their language, and they learned his. His anticipation grew as their earth movers and recovery drones cleared the blocked passageways leading to his throne room.

By the time the Clerics finally reached the throne room, Lum was as excited as he remembered being on his Coronation day. When he heard the cleric finally say, ""the king has been found"", his geothermal heart skipped a beat, blowing every fuse in the lower east side.

The city was whole again. His city.",1488170251.0,https://www.reddit.com/r/shortscifistories/comments/5wc9ds/the_king_has_been_found/,The King Has Been Found,35,5,5wc9ds
"The universe is dying. 

I dont mean the stars are dying; those burned out trillions of years ago. I dont mean really mean people, though our fates are tied to that of the universe. Weve held on as long as we could, but all of our tricks are running out. 

First, we simply abandoned our planets as the stars grew too hot or expanded or exploded. We knew, though, that eventually there would be no new stars to move to. We began to prolong the effective lives of our stars with giant, spherical nets cast around them to capture their energy. By casting these nets early in the stars life, we could redirect nearly all of the energy to fuel our planets, rather than let any radiate away into deep space. These nets were built to survive the eventual expansion, and they captured all of the stars energy through the red giant phase, yet were efficient enough to pick up the weak power eked out by the tiny, white dwarves. Nothing could last forever, though, and eventually this energy began to run out, too. 

We eventually developed a technique to take brown dwarf stars, those tiny remnants that never gathered enough material to begin fusion, and change their paths throughout their respective galaxies so that they would eventually collide. The combined mass kindled a new red dwarf star, and the imprecision of the collisions gave us enough matter to form a planet to settle on. This worked, for a time, and we were happy. One could almost forget the universe was mostly gone, until night fell and the dark, moonsless skies revealed the true emptiness of the universe.

We had to evolve, to adapt ourselves to these new conditions, mostly through applied biotechnologies. We changed our bodies to require less energy to function. We married ourselves to our technology, so that we eventually didnt even need a planet to settle. We lived in the void between stars, absorbing energy from them to function. We eventually adapted to live off the decay energy of white dwarves and even the background radiation of the universe, even as they, too, faded to black. Systems still went dark, our hyperefficient, low-power bodies still starving to death. As I came across others, I would copy their information into mine, so that they would never truly die, as long as there was even one of us left to hold onto our souls. Over time, I had become one person with the experience of trillions. 

I fear I may be the last in my galaxy. I havent seen another person in nearly a billion years, though that is quite a short time these days. 

Some time ago, there was a communication sent out across all FTL bands we had ever used. It proposed plans for a device that could block dark energy across intergalactic distances. Sure, wed all learned to manipulate dark energy in order to properly effect superluminal travel, but to simply turn it off? If it worked, the galaxies that had been separated by impossible distances would start to collapse back together. It would take eons before any collision happened, but we were all capable of waiting unfathomably long times, with our functions - and thus power usage - turned down to minimum.

When enough of these collisions occurred, eventually the mass collection would begin to resemble Big Bang conditions. The machine would make sure everything collided properly, instead of simply being caught in orbits around each other. And when enough of it did, the theory went, a new Big Bang would be touched off. Stars would rekindle, the universe would live again. Those of us whod had the foresight to stay out of the proverbial furnace would then have a whole new, albeit smaller, universe to inhabit. I could recreate individual bodies again, and split myself back into the civilizations I once was. With the lack of dark energy still propagating across the universe, other parts of the universe could be pulled in. The universe could live again! And with these plans already known, we could keep this process up, potentially forever. Wed need a large net around our new universe, to capture stray energy, but it could work. This would be no mere stopgap; it would be a cyclic renewal. Actual eternity was in our grasp.

The problem was, the machine required far more energy than existed in any single galaxy, anymore. Oh, at one point, a couple of big stars and the materials from their systems would have been more than enough, but these days an entire galaxy barely held the energy of the smallest of dwarf stars. It would take thousands of galaxies working together in order to complete the machine.

Every few million years, Id receive another communication broadcast saying that another part had been completed. Some other entity would have dragged their galaxy along and assembled another component, using whatever energy they had to power it. Then they would announce that they had retreated to a sufficiently far distance, and gone to sleep. 

By my calculations, I held one of only a few galaxies within range to get the machine completed. Communications had also indicated that enough parts had been assembled, it might only take one more of us to complete the machine and turn it on. That was assuming that entropy hadnt distorted or otherwise ruined the work that had been done. 

I have enough matter assembled. I have enough energy left to turn it on. I might be the last one left who can do it. All I can do now is hope, wish that maybe I might be all that is needed to finish the job.

Ive been travelling towards the broadcast location for billions of years. Weve been scattered so far. Would this machine even be enough?

It would have to be. I would have to be. 

Im close, now, cosmically speaking. A few more millennia, and Ill be there.

Im so close. 

Im so lonely. ",1452732932.0,https://www.reddit.com/r/shortscifistories/comments/40svk3/the_death_of_the_universe/,The Death of the Universe,31,6,40svk3
"Vessel A-59 was sent to a wormhole carrying a million-odd colonists and was bound to a habitable planet orbiting a G2V star in the Virgo Supercluster. The mission was to populate the planet and turn it into an annex, as the planets of the Home Star are no longer feasible for future habitation.

Out of the million variables in play, the one that was not accounted for was the solar flare that knocked the vessel out of its intended flight plan, and took out all the nav systems on board.

Instead of a smooth rocket-assisted landing, A-59 crash landed into the planet and ultimately caused an impact crater so huge, the unsettled dust covered the planet's atmosphere and killed its inhabitants.

The colonists stayed inside the vessel until they ran out of food and life support. One day, they were forced to climb out.

No one knew what happened to the colonists until a hyperspace probe from Annex-26.1 surveying the Virgo Supercluster picked up a deep-space craft of unknown origin.

The probe was identified by cryptographers as Voyager-1 from a planet called ""Earth"", and it carried a primitive disc containing various audiovisual recordings of the planet. It was millions of years old, far outdating the first people of the first planet of the Home Star.

Yet they all cheered and rejoiced to find out that somehow, A-59 survived after all.",1447534439.0,https://www.reddit.com/r/shortscifistories/comments/3srykl/back_to_earth/,Back to Earth,33,5,3srykl
"""The multiverse is strange, isn't it.""

""Strange is relative, Richard. Should we activate the machine?""

""I'm not sure. Opening the door to infinity just doesn't sound like a good idea.""

""We're not 'opening the door' per say, just exposing our universe to the infinite number of other universes out there. We're more... blending the seams, a bit.""

""I've been thinking. Literally everything is out there, right? What if there is a creature, capable of crossing between universes, who loves eating men named Richard? I'd be dead the second you turned the machine on.""

""But then there exists a creature whose sole purpose in life is eating that creature, right? I mean, just by the nature of infinity alone.""

""Yeah I guess.""

""So we'll activate it then?""

""One second, Alan. So what if there is a multidimensional creature, you know a hundred tentacles or whatever, somewhere out there who's processes of natural selection and influence have moved it to a life of turning off devices that expose isolated universes to the multiverse?""

""Don't be stupid, Richard.""

""That creature would exist somewhere, right? An infinite number of infinite possibilities. It'd be impossible if it didn't exist.""

""That's just ridiculous. Let's just turn this thing on, I want to start my research. Are you ready or not?""

""I'm not sure.""

""Okay Richard, here we go. Three... two... one...""

""I'm not sure about this, Alan.""

""I've flipped the initial fabric distorter... power is now coming over from the batteries... 

Oh!""

""What is it, Alan?""

""Powers dead. Someone flipped the switch back.""

""Wasn't me.""

""I know it wasn't.""

""Who was it?""

""That creature you were talking about, Richard, the one with one hundred tentacles. Only it was more like pincers. Like big hairy pincers. Maybe we'd better not.""",1443677343.0,https://www.reddit.com/r/shortscifistories/comments/3n0q5t/infinite_infinities/,Infinite Infinities,34,1,3n0q5t
"In the year 2018, the human race pledged to finally travel faster than light. The scientific community had been experimenting with various physic theories and formulas in order to achieve hyperspace travel, using new concepts recently discovered. Most of the theories concerned the formation of a portal through bending and connecting two long distance points in space together, effectively shortening the distance for a spacecraft to trace and the amount of time perceived by said crafts crew. 

Although the scientific community suffered numerous drawbacks including failed experiments concerning the first phases of engine development and casualties concerning those who failed to adhere to safety guidelines, the technology was finalized in 2027. It involved an engine capable of generating spatial-bending energy, called the Jump. 

The world watched with held breaths as the first space-flight using the Jump, the U.S.S. Terra, entered hyperspace in 2029. U.S.S. Terra had a crew consisting of five young and healthy men and women who were trained to survive the forces generated by the accelerated travel and the psychological effects. In order to impress the public, NASA was lobbied by famous politicians to keep the crew awake during the First Jump. U.S.S. Terra launched from Cape Canaveral and began its Jump to the planet Mars. It disappeared in a blink of an eye at the sound of one. 

However, during the .00000000013 seconds of the Jump, something went wrong. 

The U.S.S. Terra reappeared near Mars, the craft was undamaged. Video communication had been affected immensely via unknown causes. Audio communication was also affected but it still operated at light capacity. NASA scientists stationed in the control room could hear only static at first coming from the communication panel of the U.S.S. Terra. They soon could make out a few words whispered into the feed, it sounded like one of the crew members but it was distorted. 

He saw us through the Red Walls. 

All audio communication failed, the tracking signal on the craft also failed, and all technological status information being relayed to NASA computers glitched out. 

The U.S.S. Terra was never located.",1503218194.0,https://www.reddit.com/r/shortscifistories/comments/6usqkd/hyperspace/,Hyperspace,28,5,6usqkd
"...Ok, seriously. Where are we going?

**Dude, youre gonna freak when you see this. I promise.**

This place is so creepy. Theres seriously nothing out here.

**Dude. Just chill. Its fine. Nobody knows were here. We wont get in trouble.** 

Waitis that it?

**Pretty sick, right?**

Is it really abandoned? Like, seriously? How did you find it?

**I heard my dad talking about it last night. I guess he and his crew sort of ran into it on their patrols. Its called Earth. Yeah, so its not exactly abandoned.**

Dude, what? Seriously?

**Yeah. So the dominant species made the whole planet like, break out into nuclear war? Or something? And the survivors uploaded their conscious minds into these worldwide mega-computers. So theyre basically still alive forever, just... living in a virtual fantasy world? I guess? But yeah, other than that, this entire planet is, like... abandoned.**

Thats wild. Absolutely fucking wild.

**I know, right? Should we fuck with it?**

No way, dude. Your dad will kill us. He doesnt even know you borrowed his ship.

**Right, but do you want to hear something even sketchier? Okay, this sentient species, get this, before they uploaded themselves into the computers, they were made out of wet meat. Look at this photo of one. Can you believe that shit?**

Fuck, dude. Thats so nasty. Is that a mouth in the middle of its head? Ughhh. Im so skeeved out.

**So do you wanna nuke it?**

The planet?

**This ship has missiles on it. These babies can take out an entire world. Especially one whose inhabitants are defenseless wusses.**

I dunno, man. Thats mean. Theyre just trying to have nice little meat-dreams so they dont fuck their meat-planet up again. Its not cool to wipe out an entire species. Lets just leave them alone.

**Dude. Im doing it. Im gonna nuke it.**

I mean... whatever. Not like they can stop you.

...

**Hah! Check that out! That was a pretty sweet explosion, right?**

I guess.

**Yeah.**

...

So what do you want to do for the rest of the night before your dad gets back?

**I dunno. I heard Procyon-3 has a newly civilized species. Wanna go appear in the sky and make them worship us as gods?**

Yeah. I guess. Sounds cool. Sure.

**...Whats wrong?**

Nothing. Lets just get out of here, okay? This place is giving me the creeps.",1494633533.0,https://www.reddit.com/r/shortscifistories/comments/6as61i/come_on_dad_dont_tell_me_you_never_committed_a/,"Come on, Dad. Dont tell me YOU never committed a few genocides when you were my age.",32,9,6as61i
"
The strange little man sat on the fireplace mantle, slumped to the side, staring straight ahead with unblinking metallic eyes.

""Helena?"" I called to my daughter, feeling suddenly rather alarmed, and needing her close to me. ""Do you know anything about this?""

""It's just a Melf on the Shelf,"" Helena said as her small hand slid into mine, her casual concern doing nothing to mellow my own. ""We all got one from school today, when we started studying Panoptic Government Surveillance.""

""Ah,"" I said, gripping her hand tighter. ""And what's a Melf?""

Her eyes shone, and her upturned little face brightened. Helena never passed up an opportunity to tell stories.

""They're magical, Mama! After the government accidentally shot down Santa's sleigh, they gave him a spaceship. Then he could search the universe for more children to punish or reward. And that's when he found the planet Melf. The people there were just like us, but super teeny tiny! Santa was so kind to bring them back to Earth. He wanted to give them good homes with loving human families. Then he installed little cameras in their eyes, so he can watch us all the time. He even monitors grown-ups! With the Melf's help, he always knows if we're being well-behaved or sub... sub... ummm..."" her brow furrowed in concentration.

""Subversive?"" I offered.

""Yeah!"" she exclaimed. ""The Melf is so clever. Every night, he sends the videos he records with his eyeballs to the government. That's how good kids get presents! The bad ones...""

""What happens to the bad ones?"" I whispered.

""I don't know, Mama,"" she shrugged. ""The teacher couldn't tell us that. It's class... classif...""

""Classified,"" I said.

Her hand released mine as she nonchalantly returned to her toy robots. And I turned my gaze back to the floppy creature sprawled on the mantle.

As I did, its pupils abruptly dilated with the soft metallic screech of shifting mechanisms. Its head began to lift. A menacing smile started to creep across its face.

I picked it up, and threw it into the fire.

Thensuddenlya knock at the door.
",1482536739.0,https://www.reddit.com/r/shortscifistories/comments/5jxp00/melf_on_the_shelf/,Melf on the Shelf,34,8,5jxp00
