body,created,url,title,score,comms_num,id
"I sat across from myself at the table. I didn't look like I did in the mirror - I looked like I did in photographs. I wondered, was he thinking what I was thinking? He was more relaxed than I was. It still felt incredibly awkward, being in a room with myself. According to him, he was me from 5 days in the future. It had been 3 days since he first burst into existence in the safety cage, and this was the first time I had been allowed to meet him.

He spoke first, with an uncomfortable smile.

""Hi""

His voice sounded higher than mine.

""Hi"" I said back.

I struggled to think of what to say.

""Where have you been staying?"" I said.

""In the hotel across the street. It's pretty classy, you're gonna like it.""

""Yeah, I've been wondering about that... presumably, it's 2 days to go before I go into the cage?""

""Yeah.""

""What if I don't go?""

He leant on the table. ""We'll get to that.""

Of course - he's had this conversation before.

""Well, you seem fine. Did everything go alright?"" I said.

""Pretty much. I arrived at 4 in the morning though, had to wait for a few hours to be let out.""

We both laughed.

""I can live with that. Just as long as...""

And then we spoke in unison;

""...I don't come out with two heads.""

That wasn't so funny. We sat in silence for a bit longer.

""What number am I thinking of?"" I said.

""5"" he said.

""Nope, 7.""

Now I was confused.

""You must have had this conversation from my point of view, how can you not remember what you said?""

""I do remember! I said 5, I'm certain.""

""Then why was I thinking 7?""

""Each timeline is different, because each time we have a slightly different conversation. That's what I was told. Different timelines, each slightly different, going on and on.""

""So our experiment"", I said, ""it's creating an infinite number of different universes?""

""Not infinite. Only the number of times you go into the cage. Eventually, the person in your chair is going to decide not to.""

That thought hadn't crossed my mind. I'd been so caught up thinking this was a time loop, it didn't occur to me it could be different every time. He'd had longer to think about this than me.

I asked the obvious question;

""How many times have I gone into the cage?""

""The guy before me said five million, two hundred and five thousand, six hundred and twelve times. I guess that's the number you have to remember.""

""Holy shit! So in 2 days, I'm going to be number 5,205,614?""

""If you go into the cage, that is. You are though, aren't you?""

""Of course I am! I'll be the world's first time traveller!""

""Haha, that's exactly what I said!""

""You know, I think this might go on for forever after all.""

He smiled and nodded. Some things never change.",1436507234.0,https://www.reddit.com/r/shortscifistories/comments/3cq4z5/i_sat_across_from_myself_at_the_table/,I sat across from myself at the table.,40,3,3cq4z5
"We weren't always alone. There used to be more of us. Stretching out through the midnight stars and turning galaxies. The night used to sing with our voices and teem with us, countless men and women, as human as you or I. We multiplied and filled our universe to its brim.
We should never had listened to the idea. We should never have shared the signal, voice to ear, across the crowd of existence. But we did, and when a trillion trillion trillion people all think an idea, that idea can grow bigger than even them. What started as a scary thought experiment to provide new diversion became a meme, then became a archetype, and then became a reality.
Now, the unending landscape that we used to live and grow in has shrunken down to barely enough room for the few billions of us that are left. What were once our fields and oceans and forests have become black, empty, and colder than ice. Our great hearth fires are now tiny and isolated, so far from one another that they appear as pinpricks to each other. We are living in the dying body of existence.
There used to be more of us, but now, we are all we've got. All because someone suggested that stories should have endings.",1395210672.0,https://www.reddit.com/r/shortscifistories/comments/20rb3h/there_used_to_be_more_of_us/,There used to be more of us,42,3,20rb3h
"A new you in just six minutes, Rebecca read aloud from the pamphlet in her hands.

Thats right, said the man behind the Do-Over booth, whod introduced himself as Tim or Tom - she couldnt remember which.
 
And thats it? Six minutes and youre a whole different person?

Well, theres a little more to it, he said. The mental easing, erasing and reprogramming necessarily only takes six minutes. For the next 48 hours or so our technicians induce a deep, healing sleep while the logistics team sets up your new habitat - new apartment, wardrobe, temp job or education (according to your preference) - and schedules a meeting with a Do-Over Starter Friend.

And what about my old life? Will I remember any of it?

Weve never had a relapse yet, Tim/Tom said, beaming. Our Starter Friends are first-rate undercover tour guides to your new life. Theyre specially trained to keep you away from any triggering material for the first month or so. Theyll introduce you - organically, of course, and without blowing their cover - to a whole new suite of hobbies and experiences before taking a job across the country and gradually cutting off contact. Youll be a bit disappointed to lose such a good friend, of course, but eventually thatll fade and youll be left seamlessly integrated into a whole new you. Youll remember nothing of the life you left behind. We even disguise our billing by distributing it across innocuous little paycheck withholdings - itll be line-itemed as local taxes or service and processing fees or something like that. 

Rebecca turned the pamphlet over and over in her hands.

And the six minutes? Whats that about? 

Well - and, understand, this is a tried-and-true procedure - but the fact of the matter is your brain has to be effectively turned off for the programming to take hold. The adult human brain can only function that way for about six minutes before brain death occurs, so we have to get in and get out in the time it takes to play Sympathy for the Devil.

Rebecca grimaced at the pamphlet and then at Tim/Tom. His big blue eyes crinkled at the corners.

Its not something we like to crow about, he said. Its like sausage. No one wants to know all the gory little details. But weve been at this for 12 years now without a single failure, and its becoming the new big thing - hardly anyone goes through their entire natural life as the same person anymore.

Rebecca put the pamphlet down and put her hands in her pockets.
 
Well, thank you for your time, Im just-

If I may, said Tom. Could you just do one thing for me?

I really need to-

Just one quick thing? Can you check your purse for a little pink and purple card? Looks something like this? 

Tom held up a rectangular business card with a row of black dots at the bottom.

Rebecca opened her purse and flipped through her credit cards. Sure enough, she found a crinkled pink and purple card wedged inside.

Ah, now, see - you really dont have any excuse now, said Tom, taking the card from her. She noticed that four of the five black dots at the bottom of her card had been punched out. Youve earned a free Do-Over, anyway.
",1455686832.0,https://www.reddit.com/r/shortscifistories/comments/464oxz/six_minutes/,Six Minutes,38,6,464oxz
"""I know you've heard what I do to my targets. There's a reason they beg for a bullet in the head.""

The thin man across from me nodded slowly, his eyes hinting at fear. They reflected the many flashing lights of his dark office.

""They call you the Witherman. They say you kill your targets by turning them into old men. In an instant.""

""An instant for you and me, sure. But, for them, a lifetime.""

I couldn't help but smile when I said this. A great, big, toothy grin.

""I don't understand"", the thin man said.

""You see this device attached to my arm?"" I gestured to the sleek contraption wrapped around my forearm. It vibrated silently. ""It's my own design. I'm an engineer, of sorts. And this device is the reason you're paying me five times what you'd pay one of my competitors. I could just shoot my targets, sure. But a bullet in the head is messy. It's brutish. It's quick."" 

I re-positioned myself in my chair.

""Many years ago I was able to prove that stopping time is impossible. However, slowing down time is almost trivial. Once you get the idea down, of course. Certain physical properties we take for granted go right out the window, at that rate. Manipulation of the physical world is impossible, for one. And, most importantly...""

I leaned forward, making sure to meet the man's eye. My smile stretched to my ears.

""You cannot die. Not until old age takes you, anyway.""

The thin man stared at me. Calmly at first. Then his eyes widened.

""Christ, you're not killing them. You're just slowing them down...""

""All I have to do is grab them. I'm sure they try as hard as they can to break my grasp, but like I said, any physical manipulation is impossible. And then they wait. They wait a lifetime.""

The pattering of rain was the only thing that disturbed the heavy air. The man turned to look out his window, into the city. 

""Can you have this one done by tomorrow night?"", he said.

""Of course.""

The thin man turned to me. A small smile found it's way onto his face.

""Well then. See you soon, Mr. Wilkerson"", he said.",1438001021.0,https://www.reddit.com/r/shortscifistories/comments/3eqjhw/chronokill/,Chronokill,43,2,3eqjhw
"The cannon was ready, the greatest death machine in the American history. The first test shot was fired into the skies, targeting Mars to see the impact of the missile from a safe distance. How great was our surprise when the shot was retaliated half an hour later.",1430272068.0,https://www.reddit.com/r/shortscifistories/comments/346elo/cannon_test/,Cannon test,42,5,346elo
"I finally built it, a loop of circuitry and metal that would serve as a gateway to any time I wanted. Though there were many events I wanted to visit as the first ever time traveler, like Nov.22 1963 to see if Oswald did kill Kennedy, one event stood above all others. I program in Bethlehem, Dec.24 1 BC.

The time gateway begins to glow blue, I take a deep breath and walk through it. Theres a bright flash and I see a vast expanse of desert. Yet around me are hundreds of men in white. Three of them rush me, over their shoulders I see other bursts of light and travelers like me walking through similar gateways.

What the heck? I say shocked as Im restrained and quickly herded into the growing group of new arrivals, each in clothing reminiscent of various sci-fi films. One guy being pushed into me tells me hes from the year 2144 and hes the first time traveler. A woman shouts shes the first time traveler.

A wall of figures clothed in white surround us. We're all silenced when one shouts, You've heard of bait cars, cars that are purposely put on the street to catch thieves, well this is a bait time. It's one of many... This is why you're all the first time traveler. That man in white raises his arm, pauses, and then lowers it. Guns are fired and 142 bodies fall limp to the sand.",1417418895.0,https://www.reddit.com/r/shortscifistories/comments/2nvwxd/the_first_time_traveler/,The First Time traveler,42,7,2nvwxd
"The gates were hailed as the saviors of the human race. Faster than light travel had eluded them, limiting them to a single system. They stagnated, trapped, until the gateways. Two gates created together, forever linked, offering instant transmission between them. They had to travel apart at normal speeds, but once they reached their destination the humans could go between them at will. Fleets of ships that were no more than glorified boxes containing a gate were launched to every conceivable destination. 
 
Some of these ships took decades. Some centuries. Some millennia. The humans, with the galaxy opened to them, were not patient enough to see what the first gateways could offer before firing more to the other end of the galaxy. The humans took their first real ability to spread across the galaxy and ran with it, sending them to any planet that looked like a person could stand on it in a space suit. 
 
And so they spread, colonizing the galaxy and spreading further and further from their home. As new worlds opened up humans flocked from their dreary home to ever more exotic planets, using their mastery of technology to turn once-dead planets into lush gardens teeming with life. They built ever greater monuments while continuing to send their clouds of portals across the universe. 
 
Millions of years later, a gate landed at a destination that was the furthest yet achieved. The humans couldnt have known this when they launched the gate, but this planet was special. This destination was our home. We are younger than the humans, but even then we were old enough to recognize an alien ship. In our million years of existence we had not yet managed the leap of faster than light travel and had never seen another sign of life. 
 
So it was with awe that we watched their glorified box land on the outskirts of a city. Its sides folded down, becoming ramps to the true cargo. A dull grey metallic arch, filled with a glimpse of the first alien world we had seen. 
 
The remains of planet Earth were beautiful. Gleaming towers of glass and gold stood cracked and crumbling. Homes carved of the most beautiful stone lay fallen and broken. Buildings and structures whose purpose we couldnt begin to guess dotted the landscape, rusted and overgrown with vines. Across the planet the land teemed with life, but not the ones who had built the gates. 
 
We were filled with sorrow. Brothers and sisters we had never known had led us to their home, but they were already gone. Across their world, across their system, are thousands of gates leading to thousands of destinations. These thousands of destinations each lead to a thousand more possible homes. Every world we find is barren. Every world we find is beautiful. 
 
We follow in the footsteps of man, hoping to meet the ones who have shown us the universe. 
",1495712109.0,https://www.reddit.com/r/shortscifistories/comments/6d76aw/in_the_footsteps_of_man/,In the Footsteps of Man,37,6,6d76aw
"You cant make a good snowball on Tau Ceti-2. 

The constant below-zero temperature of the surface and the extreme low humidity result in a fine frozen powder. Perfect for skiing, if you didnt mind the 12 light-year journey.

Maxine surveyed her work: shed cleared most of the snow from the crash site. Soon the wind would bury it again, but this had become her ritual, her way of making sure that Milo wasnt forgotten.

Decades had passed, yet he was perfectly preserved by the planets frosty air. Trapped forever in the wreck of the surveyor.

Maxine trudged back to the outpost, and cycled the airlock. After removing her exposure suit, she checked what was left of the communications console. 

Roughly eight years ago, time had largely lost meaning to her, Maxine had smashed much of the outposts equipment in a bout of loneliness and rage. Only the nuclear generator and organic recycler remained unscathed.

Radio communications couldnt leave the surface due to the planets extreme magnetic fields. So, Maxine and Milo had used Flares. Upon reaching space, these single-use rockets would broadcast a programmed message. The precious data traveled the long 12-light-year journey to Earth by line-of-sight. Upon receiving a reply, it tumbled back into the atmosphere.

Despite the damage she'd done to the com console, Maxine still knew the right series of buttons to play the audio of incoming messages. There was nothing.

It was pointless. The mission had died, as surely as Milo had, when a disruption in the planets magnetosphere fried the surveyors guidance systems.

Maxine couldnt even remember when she had last sent a Flare. 
The year Milo died in the crash? Years later? 
She had no frame of reference anymore. In her darkest moments, Maxine would wonder why no evac had come. Perhaps Earth was no more. Maybe she was the only human left in the universe.

Maxine went to bed.

Sometimes she stayed in bed for weeks, or whatever the Tau Ceti-2 equivalent of weeks is, rising only to mindlessly fulfil the tasks which kept her biologically alive. 

Eventually, the time came when Maxine was forced once again to excavate the crashed surveyor, or risk losing it forever in the snow. 

Maxine cycled the airlock and prepared to step outside. This time, however, she did not wear her exposure suit. 
She had no intention of returning. 

The door slid open. Maxine felt an agonizing slap of cold. 

It was nice to feel something.

The door slid shut behind her, and Maxine took one final glance inside what had been her home.

And she saw it. 

A light, blinking rapid and red on the com console. 

Maxine shook from her torpor and cycled the airlock with her already-numb fingers. Panting, she stumbled inside. 
Desperately she entered the memorized series of commands into the console. The cracked screen glowed to life, uselessly. 

From the tinny speakers, an authoritative voice spoke:
Earth to Tau Ceti-2. Your last communication was corrupted and did not come through.

Please re-send.
 




",1475525868.0,https://www.reddit.com/r/shortscifistories/comments/55nddo/you_cant_make_a_good_snowball_on_tau_ceti2/,You cant make a good snowball on Tau Ceti-2,38,5,55nddo
"**ARRIVING SHORTLY.**

The signal blanketed the Northern Hemisphere for 24 hours. Repeated in 10 languages, in morse and ASCII. Initially panic, then a widespread assumption of prankery. Less suicides than you'd think. Earth's median feeling was giddy uncertainty. A movie deal was made.

A week later, an amateur astronomer noticed an anomaly above Mercury. ""Big Shiny Thing"". His words. Radio signals were sent. No response. The Hubble was pointed at it. 100 km across. Changes on Mercury's Surface. An ESA probe on intercept course for an L4 asteroid was redirected.

Two weeks later, the probe lost contact.

**I WOULD PREFER YOU DID NOT WATCH.**

Some on Earth viewed this as an act of war. Interstellar War. There was much posturing in the news, which ultimately fizzled. Plans were drawn up, not publicly of course, for a swarm of nukes to be launched simultaneously from all over Earth. Nobody in charge seriously thought this would happen, but it felt good to have the plans in a drawer somewhere.

A probe from the Chinese Space Agency originally intended for the moon launched two months after the arrivial of what most now called The Visitor. It, too, lost contact after passing the orbit of Venus.

A coalition of the governments more impatient than uncooperative had a summit, then began construction of a large laser assembly, whose original purpose was to shoot down ICBMs.

Two comedy programs, one in Arabic, and one in English, featured The Visitor in a regular segment, providing commentary on Earth news. Neither could come up with a satisfying physical depiction, so they both chose a deep, booming voice emanating from the sky.

Mercury's surface albedo increased uniformly and dramatically. The Visitor started in a polar orbit, then switched to equatorial, then went out to Mercury's L2. A year 2 astrophysics question was calculating the energy required.

The laser assembly finished ahead of schedule. Precision mapping attempts of The Visitor based on laser scattering returned inconsistent, nonsensical results.

**THAT TICKLES. SCANNING US IS FUTILE. WE SUGGEST YOU DIRECT YOUR RESOURCES ELSEWHERE.**

Comedians found this hilarious, depicting The Visitor as an alien embarrassed it showed up to space school with its pants down. There was debate over whether astronauts should be kept on the International Space Station. The astronauts won.

**PLZ USE THE LASER TO SEND THIS WIKIPEDIA WE KEEP HEARING ABOUT.**

While a sub-committee of the laser committee was attempting to schedule a group call to discuss the correct response, an intern wrote some code to modulate the lasers' amplitude with an uncompressed copy of Wikipedia. This went live as the intern misunderstood an instruction from her supervisor, and was sacked briefly, then reinstated and put in charge of signaling.

**WE APOLOGIZE. THE USE OF ""FUTILE"" IN THE PRESENT CONTEXT WAS NOT THE BEST CHOICE, GIVEN ITS APPARENT CONNOTATION IN POPULAR CULTURE. WE PROMISE WE'RE GOOD. WINK.**

Four years passed. Second-rank universities started to offer programs in Visitor studies, which were such a  draw for top minds that first-rank universities grumblingly added their own. The Visitor settled into an unstable orbit between Mercury and Venus in year two. A Broadway musical, featuring a glowing light as the visitor and two actors in spherical costumes representing the planets in a ham-fisted love triangle, sweeped the Tonies. Most spaces agencies held off plans for probes to the inner solar system, but funding flourished, and several were sent to the asteroid belt. NASA launched a probe, cleverly on the opposite side of The Visitor from the sun until the last possible moment. It, too, went dark.

The Visitor's changes to Mercury had been a serious field of study by this point. Filaments criss-crossed all over its surface.

The original Wikipedia transmission had long finished. The former intern figured out a protocol for concisely communicating recent changes, and linked it in The Visitor's article (an obvious spot). After English, Wikipedia was transmitted in every language available. Serious attempts at a pure pictorial Wikipedia led to a few theses.

**CHECK OUT THIS SHIT.**

*(This message recieved in every human language that had been transmitted to The Visitor, including Tolkien Elvish and Klingon. And, in a move that was confusing to many, a bitmap diagram of the inner solar system with ""Check Out"" at the top, and ""This Shit"", and the bottom, in white block text on black.)*

Mercury suddenly slowed down. Due to orbital mechanics, it then accelerated towards the sun.

Calculations showed that Mercury, after passing the sun, was on an intercept course for Venus. No, wait, a near miss. Six months later, as Mercury approached its big sister, it slowed. Surveys indicated the filaments exerted massive force on the planet itself. At Mercury's closest point with respect to Venus, it pulled away a considerable chunk of the excessive Venusian atmosphere. The Visitor worked in overtime, never in a stable orbit, forming part of a Mercury-Venus-Visitor dance. Venus' long day sped up. A new space telescope caught images of Venus' surface, its clouds now thinner, and saw the same filaments.

Over the next year, The Visitor's apparent tinkerings with the new Mercury-Venus binary planet slowed in frequency. Venus' diurnal rotation sped up, and the distance between it and Mercury stabilized to where Venus sat safely within Mercury's magnetic field, lacking one of its own. The outgassing of Venus' atmosphere was an order of magnitude greater than what could be explained by the presence of Mercury alone, and most of that atmosphere ended up on Mercury, which was far too convenient. Mercury and Venus were having their worse parts, in terms of habitability, cancelled out. The filaments dissolved, until they were no more than scars on the planets' surfaces.

**HERE IS A GIFT. YOU ARE WELCOME. WE WILL BE BACK AGAIN, BUT NOT TOO SOON, AND AS FRIENDS. GOOD LUCK, AND HAVE FUN. WE HAVE MORE ERRANDS TO RUN.**

The Visitor accelerated violently south, from Earth's perspective, and after passing slightly more than 5 AU from the sun, disappeared in a puff of gamma radiation.
",1436450684.0,https://www.reddit.com/r/shortscifistories/comments/3cnb1v/you_are_welcome/,You Are Welcome,41,6,3cnb1v
