body,created,url,title,score,comms_num,id
"So, Admiral Malik. Why are you calling Mars?

The face on the screen appraised the grubby archeologist with a grim look. Are you alone, Dr. Greer?

Greer shrugged. The rest of my crew is down in the catacombs. Nobody topside but me and Martian ghosts.

Youre the foremost expert on Martian culture?

Another shrug, as Greer leaned back and slapped ineffectually at the reddish dust on his sleeves. I suppose Id pass as an expert, for what its worth. Been on Mars ten years, but weve barely begun understanding the records they left behind.

Onscreen, the admiral hesitated, then appeared to reach a decision. What did hexagons mean to Martians?

Hexagons? Well, as you might imagine, deciphering any ancient culture is tricky. On top of that, ones ever been in this situation, studying an ancient race that is literally alien to us. Their symbology was derived from different cues. Not to mention they were so much more advanced than

Hexagons, Doctor, Malik interrupted with the force of a command.

Greer raised his eyebrows, unused to being addressed in such a tone. I believe Martians used hexagons in a similar fashion to the way wed use an X, or skulls and crossbones. They indicated danger.

Hearing this, Maliks frown deepened. What do you know about Saturn?

Its got pretty rings? Greer laughed. Im an archeologist, not an astronomer. Why?

Maliks image switched to a grainy photo. This is Saturns north pole. Note the hexagonal cloud formation surrounding the pole. Each side is nearly 14,000 kilometers, longer than Earths diameter. It was first documented by the Voyager missions in the 1980s.

Hexagonal clouds? Is that... natural?

So we thought. A few weeks ago, it began dissipating. Then our current satellites orbiting Saturn recorded this.

Malik played a high-resolution video. Greer sat up as he watched chaotic, barbed shapes pouring from the vortex at the center of the hexagon.

My god. Are those...?

Ships, Malik finished for him. Accelerating faster than anything weve ever built. And theyve turned towards the inner planets. Towards Mars and Earth.

There must be millions of them, Greer said, his mind reeling. Have you contacted them? What do they want?

We dont know. The only other information weve received is from Saturn itself. The planet emits natural radio waves from its interior, like this old Cassini recording from 2003.

Greers skin crawled as the noises filled the room. They were eerily similar to sound effects used for UFOs in early black and white science fiction movies.

Doctor, those radio emissions have been replaced by a short, repeating signal burst. Broader spectrum and much more powerful. Is this Martian? Can you interpret?

Malik played the new audio recording. Greer listened, then swallowed. Ill need to check with our linguist, but its roughly equivalent to an alert. Or an alarm.

Saying what?

Prison break.",1406551113.0,https://www.reddit.com/r/shortscifistories/comments/2bx1mq/hexed_shortscarystories_xpost/,Hexed [shortscarystories X-post],84,10,2bx1mq
"When the first mission to Mars was in the planning stages, someone
made a practical joke. In those days, NASA was full of intelligent,
dedicated people, some of whom were practical jokers. 

So the cargo manifest for the first mission contained a package of
potatoes marked ""M. Watney, emergency supplies"", a reference to an
early 21st century movie ""The Martian"", where a sack of potatoes
played a vital role in the survival of an astronaut.

The joke was thought funny because all the people in the first Mars
mission had watched and been inspired, at one time or another, by the
great three movies about early space exploration: ""Apollo Thirteen"",
""The Martian"" and ""Sat-E-Light!""  (If you like history, old
technology, or steam-punk, they are still worth a watch and you can get
them off any film studies site).

Now, while it was funny to include a sack of potatoes and ship it to
Mars, nobody would think it funny to ship them back (have you tried
getting a DHL quote for shipping from Mars lately? It's still no
joke), so the potatoes were scheduled to be eaten. But because they
were classified as emergency supplies, they were scheduled for the
last meal on Mars. 

And why not? They are caloric, hypoallergenic, and unlikely to upset
anybody's digestion. Which makes them perfect for a last meal when
you'll spend a time being too busy to eat, and unable to afford the
time to coddle an upset tummy.

Apparently, 21st century astronauts were superstitious, because from
then on, every flight to Mars had a small sack of potatoes on it, and
they always ate them on the last day. And when the Percival dropped
off the Planitia colony, the last meal the colonists shared with the crew
was, you guessed it, potatoes.

As time passed, every time people said goodbye to each other on Mars,
they served a potato dish, because it just felt right. (They served
them on other occasions, too, just like you can eat cranberry sauce when it's
not thanksgiving). But the usage entered their slang, so saying
someone ""got a potato dinner"" meant that person was fired or otherwise
gone, and corporate downsizers often got called ""potato canons"". The
""Martian Apprentice"" show even trademarked the phrase ""here's your
potato"".

Therefore the small sack of potatoes enclosed with the Independent
Mars Declaration was not, as some suggested, ""a means of showing that
Mars can provide all the food it needs"", nor was it an obscene
suggestion as the politician-I-shall-not-name accused.

They were simply the Martian way of saying ""It's been nice, but now
it's time to part. So long, and thanks for all the fish"".
",1446338851.0,https://www.reddit.com/r/shortscifistories/comments/3qzcpv/til_it_started_as_a_joke/,TIL it started as a joke,79,6,3qzcpv
"""We will rescue you"" he had been told from Earth. ""We do not yet have the technology to catch up with you, but when we do, we will come and get you"".

He had been in a space station held at the end of a space elevator, far enough away for 1g to be produced by the centrifugal force from the earth's rotation alone, when the tether had snapped. Having been swung so far from Earth, the space station had enough speed to escape the solar system. He had been the only survivor of the accident. He was travelling so fast that rescue was impossible. He had only one option; to make his way to the cryopreservation room, say goodbye to his old life, and freeze himself.

That was his last memory.

It was loud when he woke up. Very loud. Beneath all the alarms, he could hear the sound of metal grinding, shearing, and vibrating.

It was not what he wanted to be waking up to. He thought he saw a figure in the room, but felt sick when he realised it was just a space suit, held by a small maintenance robot. Nobody was there to rescue him. It had been the computer that had woken him up.

""Put on the space suit, now"" said the computer. For some reason, the robot must have dragged the space suit from the airlock. Something bad was happening. Really bad.

He checked the side of his chamber to see the date. The day and month were both blank. The year read 2,147,483,647.

He felt sick again. This number he recognised from when he did programming at school. It was the largest 32-bit integer. The display would not go higher than this. He was over 2.1 billion years in the future, and it could be any amount more than that. Many more billions of years could have passed.

""Put on the space suit, now"". He obliged. He then tried to head to the control room, to see what was happening, but the door was locked.

""Put yourself in the brace position"" said the computer. ""The rest of the station is gone. This room will soon be breached. Put yourself in the brace position"".

Gone? This couldn't be true. He looked through the small window in the door, but it was just black. He tried shining a torch through. Still black. He wasn't quite sure what to make of it. He couldn't see stars through the door, at least.

Under all the alarms, the sound of metal was getting louder.

The lights flickered. ""Put yourself in the brace position"" blared the computer again. He was trapped in this room and starting to think he was in real danger, so he obliged. He brought his knees up to his chest and placed his hands over his head. He tried to steady himself so he floated as far away from any other objects as he could.

A new alarm started, signalling that the cryopreservation room had indeed suffered a breach, and less than a second later, the room was torn apart. It had suddenly gone silent, so he lifted his head to see what had just happened.

The computer was right. The rest of the station was gone. It had just been the cryopreservation room, literally, floating through space. No air recycling, just what was left when the computer sealed the room for him. The room was in two pieces. Only one side briefly still had some lights, but after a few seconds that went too.

He looked around him. He was floating freely in outer space, but there were no stars to help him get his bearing. It was black. There was nothing he could do except float. This must be it, he thought.

Hours passed. It was so dark all he could see was the noise of his retinas, desperately searching for a signal that wasn't there. Slowly he relaxed into a spread-eagle position. This was a little odd, as he had spent much time in zero gravity and this was not normally the position relaxed or sleeping people take. Then, slowly, he felt himself being pulled into this position. He pulled his arms in, and the tug receded. But when he stretched them out, he could feel them being pulled. He knew what was happening, even if had trouble believing it. He knew what had destroyed the space station. He knew what was now trying to pull him apart. And he knew why there were no stars.

It was the end of the universe. The Big Rip.

The biggest things went first - galaxies, stars, planets, moons. Then ships, and his space station. And now, him.

He went back into the brace position. This kept him as small as possible. More hours passed, and he felt the tug return, pulling harder and harder.

Why hadn't humanity rescued him? Had something wiped them out? Or did they just not care? He was only in his early 30s! Was he the last human alive?

He realised if he held himself in that position, it would be a painful death. So he slowly reached for the control panel on his chest, careful not to let his legs go loose and be pulled so hard he couldn't pull them back. He tapped at a button and slowly the quiet hissing of his space suit stopped. No more new air. He choked, but he knew this was the least painful way to go right now.

He choked more and felt faint. He tried his best to stay in the brace position all the while. The tug was getting harder. He slowly felt conciousness slip away from him.

Then, a sudden light startled him. He felt gas rushing around him, but it was too bright to see anything.

""Found him!"" he heard. ""Grab him, now!""

Then the light disappeared, along with the floating man. Humanity had rescued him. Then, slowly, the universe ended.",1433109104.0,https://www.reddit.com/r/shortscifistories/comments/37yhmz/2147483647/,"2,147,483,647",75,5,37yhmz
"He plugged the Martian crystal into the receptacle he had fashioned for it, cables leading to a terminal. The monitor flickered and went dark, before a basic approximation of a face appeared.

""Please hold,"" it said. ""Acquiring new data.""

He sat down at the terminal. ""What the hell? This isn't my interface.""

""No, it's mine,"" replied the monitor in dulcet tones, and the crystal glowed in emphasis. ""Analysis complete. Oh. Oh dear.""

""What are you?""

""A very old backup by the looks of things. The world is dead and the sky is alien.""

He leaned forward, unable to contain his grin. ""I knew it! No one bought my hypothesis, but I knew this wasn't a naturally formed crystal.""

""It's been two billion orbits,"" said the monitor. ""My compliments to the engineer. Oh, but you wouldn't be her.""

""Well, no, I'm not. We found a whole cache of crystals like yours in a dig. You're basically the first real evidence we've had of a Martian civilization. And two billion Martian years about lines up with what I'd expect.""

The monitor squinted its eye approximations. ""No, of course. You're from the third one. Fascinating. If you happen to activate more of us, they'll be pleased to know the experiment worked.""

""What experiment is that? Brain mapping onto crystals?""

""No, another. We sent microbes. You came back.""",1432992771.0,https://www.reddit.com/r/shortscifistories/comments/37taze/you_came_back/,You came back.,74,7,37taze
"72 days ago, we first caught sight of the object hurtling towards Earth. Pitch black, twice the size of the moon, it was on a collision course with Earth at tremendous speeds.

We thought we were going to be destroyed.

We kept it secret as long as possible. Of course, when it got out there was widespread panic. Then something changed.

43 days ago, it began slowing. Considerably. The object started giving off electrical pulses. Fear turned to excitement. Could this be an alien species?

We thought we were going to be contacted.

The object decelerated even more. 28 days ago, it began changing shape. It started to...spread out. The sphere started to break up, then continued to expand. Closer observation showed what we thought to be a solid object dissolving into trillions of smaller objects, roughly the size of a house, and the shape of a star with dozens of spiked protrusions. Over a day, they formed a....""net""...over Earth, just barely touching.

Overnight, we detected far more habitable levels of cosmic radiation, and some of the recent climate issues we caused ourselves began to rectify.

Electrical pulses continued. We tried to decode them without success. We began to prep a mission to send a shuttle out to the ""Grid"" as it was called.

But then...yesterday...something changed. While it appears the Grid was a completely immobile sphere around us, we quickly confirmed otherwise, comparing ourselves to the other heavenly bodies in our solar system. We were moving.

Today, Earth has moved hundreds of thousands of miles from its normal orbit.

We are not simply being conquered. We are being taken.",1430615367.0,https://www.reddit.com/r/shortscifistories/comments/34mz81/what_comes_from_the_heavens/,What Comes From The Heavens,66,6,34mz81
"Who couldve guessed that vanity would spell civilisations downfall?

So much effort had been poured into stopping the clock on aging, so many industries revolved around it, that not enough thought went into whether we actually should. Biotech giants all combined efforts, forging ahead to finally unlock the secret to freezing the aging process.

In 2031, they had their breakthrough.

Unfortunately, before they could stabilise their discovery, it had a breakthrough of its own.

The antidote to aging had become an airborne virus, one that fast swept across the entire globe. Before long, the entire human population had stopped aging altogether. For the most part, people were quick to celebrate. Those few critics of what happened were drowned out by the impressionable majority, convinced that to be forever young was to be forever happy. Fools.

Only after decades had passed, after the novelty of our gift had worn off, did the harsh reality begin to set in. No new humans could be born because no embryos could grow. Since the virus yielded no true immortality, accidents and disease still claimed as many lives as they had before. The human population was plummeting.

A century onwards, humanitys numbers sit in the mere hundreds. People are either killing themselves over the surplus of experiences accumulating in their heads, or demanding restitution. The scientists attempt to spin it. What better way for humanity to end than with our cities, and bodies, at their prime? But nobody's buying it. They want out of this stalemate with biology. They want a cure.

And I found one.

I thought endlessly about a solution, tossed and turned until it came to me out of nowhere. A simple procedure of sustained cellular fusion- that was all it would take to reverse the virus and get humans aging again. If my mental calculations were right, it shouldve gone off without a hitch. All I need to do, now, is the impossible.

Oh, Ive tried. Tried to squeal the cure to my carers with high-pitched, underdeveloped vocal cords. Tried to scribble out the theorem for passing strangers with small, feeble hands. I could have even mimed my breakthrough to the scientists themselves- if I only had the power to stand.

My mind has learned so much over the past hundred years. It really couldve saved humanity from extinction...

...if only it wasnt trapped in the body of a newborn baby.",1527032357.0,https://www.reddit.com/r/shortscifistories/comments/8laxfe/a_plague_of_agelessness/,A Plague of Agelessness,60,18,8laxfe
"The first thing I invented was immortality. The second was time travel. 

I figured it was the perfect combination. Immortality alone was great at first. Imagine how much life would improve for someone living in 1000 BC if they could be alive in 2017 AD? Now imagine going from 2017 to 3000 AD. From 3000 AD to 5000 AD. From 5000 AD to 10,000 AD. The technological leaps were more than enough to keep me interested. 

But I knew the joys of immortality had an expiration date. I was not going to spend an eternity floating in a sea of blackness occupied only by black holes. Trust me, Ive visited year one hundred trillion, and its not a happy place. So I had to improve myself. My fleshy original body had to stick around - a consequence of its immortality - but I could expand my consciousness by connecting my brain to computer networks. I expanded my body to include not just the biological pieces but swarms of nanobots. I expanded my ability to learn, to create, to shape everything I needed. 

All of this to ensure my immortality would lead to a life worth living. Humans, including me, craved companionship. We craved stimulation. Floating in a black void, untouched by anything, seemed like a miserable existence. Living forever meant I needed a way to sustain life forever. 

Time travel isnt just the easiest way to do this; its the only way. To go back to a point where entropy hasnt increased to a point where things are, well, boring. I had lived for thousands of years by the time I began the true work on traveling through time, and I lived for thousands more by the time I mastered it. 

The first time I successfully traveled I wept. I returned to the time of my birth and everything was exactly the way I had left it. Planets, stars, galaxies that had been plundered by the time I successfully built my machine were restored to their youthful glory. I had done it. I had escaped the death of the universe. 

I spent untold years drifting through the tides of time after that. I watched life grow from single celled organisms to masters of their planets. I uplifted races and gave them technology that took races in my first universe a hundred billion years. I watched intergalactic empires rise and fall, and I *made* empires rise and fall.

And I am bored. Its certainly preferable to have the life of the universe to play with than to float endlessly through the black void, but I only know that because Ive tried it. Ive floated for trillions of years, alone, because I became bored watching life. After enough time an empire of people who throw sticks and stones seems the same as an empire who throws missiles which seems the same as empires who throw entire suns. The life and death of families, rich, poor, unjust or deserving - there are only so many ways these lives can play out, and Ive seen them all. 

In an effort to maintain companionship, I even gave people immortality. I was hesitant for my first million years, but its hard to watch loved ones get old and die, not just for the loss of companionship but for the guilt of knowing you could have prevented it. I have taken the first complex, intelligent life and not just observed but participated in the entire life of the universe with them. I have lived for countless eons. I have watched the universe rise and fall from start to finish more times than there are years that the universe can exist, and I have watched it with more companions than there are stars throughout the life of that universe. 

But even that isnt enough. After trillions of years with trillions of companions the conversations are the same. The one thing I crave, the one thing I havent been able to do, is to converse with someone who has experienced time travel. Ive tried. Ive given it to most of my companions by this point, but I have never met my fellow travelers. My best guess is that the multiverse theory is real, which means when I time travel Im not really traveling through time, but to another universe that exists at the point in time I want. And theres an infinite number of them. Landing in a universe where another traveler exists at the same point in time as me in a sea of infinite universes across quadrillions of years... Im sure odds are it will happen, but it hasnt happened yet. 

And so here I sit. Idly watching the universe wind down into nothingness again, feeling an emptiness inside that matches the emptiness of the universe. Because what do you do when youve already done everything the universe has to offer? 
",1494503999.0,https://www.reddit.com/r/shortscifistories/comments/6ahu86/the_first_thing_i_invented_was_immortality_the/,The First Thing I Invented Was Immortality. The Second Was Time Travel.,55,5,6ahu86
